{
  "contractVersion": "0.1-draft",
  "kind": "criterion-proof-assertion-registry",
  "assertions": [
    {
      "artifactRoles": ["run/log"],
      "availability": "executable",
      "class": "contract",
      "criterionId": "gate-a/01-artifact-vocabulary",
      "manualProcedureId": null,
      "requiredRuns": ["contract/package-boundaries", "contract/requirement-registry"],
      "requiredSubjectIds": []
    },
    {
      "artifactRoles": [
        "manual/decision-record-v1",
        "review/attestation-v1",
        "review/signature-v1",
        "run/log"
      ],
      "availability": "manual-input",
      "class": "manual-decision",
      "criterionId": "gate-a/01-artifact-vocabulary",
      "manualProcedureId": "gate-a/01-artifact-vocabulary-v1",
      "requiredRuns": ["manual/gate-a-01-artifact-vocabulary-v1"],
      "requiredSubjectIds": []
    },
    {
      "artifactRoles": ["run/log"],
      "availability": "executable",
      "class": "contract",
      "criterionId": "gate-a/02-protocol-schemas",
      "manualProcedureId": null,
      "requiredRuns": ["contract/canonical-corpus", "profile/schema-property"],
      "requiredSubjectIds": []
    },
    {
      "artifactRoles": ["run/log"],
      "availability": "executable",
      "class": "security",
      "criterionId": "gate-a/02-protocol-schemas",
      "manualProcedureId": null,
      "requiredRuns": ["security/threat-registry", "unit/workspace"],
      "requiredSubjectIds": []
    },
    {
      "artifactRoles": ["run/log"],
      "availability": "executable",
      "class": "contract",
      "criterionId": "gate-a/03-deterministic-commands",
      "manualProcedureId": null,
      "requiredRuns": ["contract/canonical-corpus"],
      "requiredSubjectIds": []
    },
    {
      "artifactRoles": ["run/log"],
      "availability": "executable",
      "class": "property-fuzz",
      "criterionId": "gate-a/03-deterministic-commands",
      "manualProcedureId": null,
      "requiredRuns": ["profile/engine-core"],
      "requiredSubjectIds": []
    },
    {
      "artifactRoles": ["run/log"],
      "availability": "executable",
      "class": "contract",
      "criterionId": "gate-a/04-extension-theme-lifecycle",
      "manualProcedureId": null,
      "requiredRuns": ["contract/canonical-corpus"],
      "requiredSubjectIds": []
    },
    {
      "artifactRoles": ["lifecycle/contribution-report-v1", "run/log"],
      "availability": "target",
      "class": "lifecycle",
      "criterionId": "gate-a/04-extension-theme-lifecycle",
      "manualProcedureId": null,
      "requiredRuns": ["lifecycle/contribution-runtime-v1"],
      "requiredSubjectIds": []
    },
    {
      "artifactRoles": ["run/log"],
      "availability": "executable",
      "class": "contract",
      "criterionId": "gate-a/05-host-ports-negotiation",
      "manualProcedureId": null,
      "requiredRuns": ["contract/canonical-corpus"],
      "requiredSubjectIds": []
    },
    {
      "artifactRoles": [
        "integration/external-attestation-v1",
        "integration/external-subject-v1",
        "integration/kumwe-app-report-v1",
        "integration/reference-host-report-v1",
        "run/log"
      ],
      "availability": "target",
      "class": "integration",
      "criterionId": "gate-a/05-host-ports-negotiation",
      "manualProcedureId": null,
      "requiredRuns": ["integration/kumwe-app-v1", "integration/reference-host-http-v1"],
      "requiredSubjectIds": ["kumwe/app"]
    },
    {
      "artifactRoles": ["run/log"],
      "availability": "executable",
      "class": "contract",
      "criterionId": "gate-a/06-media-rich-text-boundaries",
      "manualProcedureId": null,
      "requiredRuns": ["contract/canonical-corpus"],
      "requiredSubjectIds": []
    },
    {
      "artifactRoles": [
        "integration/external-attestation-v1",
        "integration/external-subject-v1",
        "integration/kumwe-app-report-v1",
        "integration/media-rich-text-report-v1",
        "run/log"
      ],
      "availability": "target",
      "class": "integration",
      "criterionId": "gate-a/06-media-rich-text-boundaries",
      "manualProcedureId": null,
      "requiredRuns": ["integration/kumwe-app-v1", "integration/media-rich-text-v1"],
      "requiredSubjectIds": ["kumwe/app"]
    },
    {
      "artifactRoles": ["run/log"],
      "availability": "executable",
      "class": "security",
      "criterionId": "gate-a/07-threat-model",
      "manualProcedureId": null,
      "requiredRuns": ["security/secret-scan", "security/threat-registry"],
      "requiredSubjectIds": []
    },
    {
      "artifactRoles": ["run/log"],
      "availability": "executable",
      "class": "property-fuzz",
      "criterionId": "gate-a/07-threat-model",
      "manualProcedureId": null,
      "requiredRuns": ["profile/engine-core"],
      "requiredSubjectIds": []
    },
    {
      "artifactRoles": ["run/log"],
      "availability": "executable",
      "class": "contract",
      "criterionId": "gate-a/08-errors-diagnostics",
      "manualProcedureId": null,
      "requiredRuns": ["contract/canonical-corpus"],
      "requiredSubjectIds": []
    },
    {
      "artifactRoles": ["run/log"],
      "availability": "executable",
      "class": "security",
      "criterionId": "gate-a/08-errors-diagnostics",
      "manualProcedureId": null,
      "requiredRuns": ["security/threat-registry", "unit/workspace"],
      "requiredSubjectIds": []
    },
    {
      "artifactRoles": ["run/log"],
      "availability": "executable",
      "class": "contract",
      "criterionId": "gate-a/09-typescript-corpus",
      "manualProcedureId": null,
      "requiredRuns": ["contract/canonical-corpus"],
      "requiredSubjectIds": []
    },
    {
      "artifactRoles": [
        "portability/corpus-replay-v1",
        "portability/typescript-generation-v1",
        "run/log"
      ],
      "availability": "target",
      "class": "portability",
      "criterionId": "gate-a/09-typescript-corpus",
      "manualProcedureId": null,
      "requiredRuns": ["portability/typescript-corpus-v2"],
      "requiredSubjectIds": []
    },
    {
      "artifactRoles": [
        "integration/external-attestation-v1",
        "integration/external-subject-v1",
        "integration/kumwe-app-report-v1",
        "integration/reference-host-report-v1",
        "run/log"
      ],
      "availability": "target",
      "class": "integration",
      "criterionId": "gate-a/10-host-playbooks",
      "manualProcedureId": null,
      "requiredRuns": ["integration/kumwe-app-v1", "integration/reference-host-http-v1"],
      "requiredSubjectIds": ["kumwe/app"]
    },
    {
      "artifactRoles": [
        "manual/decision-record-v1",
        "review/attestation-v1",
        "review/signature-v1",
        "run/log"
      ],
      "availability": "manual-input",
      "class": "manual-decision",
      "criterionId": "gate-a/10-host-playbooks",
      "manualProcedureId": "gate-a/10-host-playbooks-v1",
      "requiredRuns": ["manual/gate-a-10-host-playbooks-v1"],
      "requiredSubjectIds": []
    },
    {
      "artifactRoles": ["run/log"],
      "availability": "executable",
      "class": "contract",
      "criterionId": "gate-a/11-evolution-release-policy",
      "manualProcedureId": null,
      "requiredRuns": ["contract/release-record", "release/changeset"],
      "requiredSubjectIds": []
    },
    {
      "artifactRoles": [
        "manual/decision-record-v1",
        "review/attestation-v1",
        "review/signature-v1",
        "run/log"
      ],
      "availability": "manual-input",
      "class": "manual-decision",
      "criterionId": "gate-a/11-evolution-release-policy",
      "manualProcedureId": "gate-a/11-evolution-policy-v1",
      "requiredRuns": ["manual/gate-a-11-evolution-policy-v1"],
      "requiredSubjectIds": []
    },
    {
      "artifactRoles": [
        "accessibility/manual-interaction-report-v1",
        "review/attestation-v1",
        "review/signature-v1",
        "run/log"
      ],
      "availability": "manual-input",
      "class": "accessibility",
      "criterionId": "gate-a/12-accessible-interactions",
      "manualProcedureId": "accessibility/gate-a-interactions-v1",
      "requiredRuns": ["accessibility/manual-interactions-v1", "accessibility/web"],
      "requiredSubjectIds": []
    },
    {
      "artifactRoles": ["run/log"],
      "availability": "executable",
      "class": "contract",
      "criterionId": "gate-a/12-accessible-interactions",
      "manualProcedureId": null,
      "requiredRuns": ["contract/canonical-corpus", "contract/requirement-registry"],
      "requiredSubjectIds": []
    },
    {
      "artifactRoles": [
        "release/approved-family-v1",
        "release/clean-consumer-lock-v1",
        "release/cyclonedx-sbom-v1",
        "release/provenance-set-v1",
        "release/reproducible-family-report-v1",
        "release/signature-audit-v1",
        "release/staged-registry-report-v1",
        "run/log"
      ],
      "availability": "target",
      "class": "release",
      "criterionId": "gate-a/13-reproducible-evidence",
      "manualProcedureId": null,
      "requiredRuns": [
        "release/package-tarballs",
        "release/reproducible-family-v1",
        "release/sbom-v1",
        "release/staged-registry-install"
      ],
      "requiredSubjectIds": []
    },
    {
      "artifactRoles": [
        "manual/decision-record-v1",
        "review/attestation-v1",
        "review/signature-v1",
        "run/log"
      ],
      "availability": "manual-input",
      "class": "manual-decision",
      "criterionId": "gate-a/13-reproducible-evidence",
      "manualProcedureId": "gate-a/13-independent-reproduction-v1",
      "requiredRuns": ["manual/gate-a-13-independent-reproduction-v1"],
      "requiredSubjectIds": []
    },
    {
      "artifactRoles": ["run/log"],
      "availability": "executable",
      "class": "security",